{
  "$schema": "http://json-schema.org/draft-07/schema#",
  "title": "Kilo Plugin Manifest",
  "type": "object",
  "properties": {
    "name": { "type": "string" },
    "version": { "type": "string" },
    "description": { "type": "string" },
    "isolate": { "type": "boolean" },
    "enabled": { "type": "boolean" },
    "requirements": { "type": "array", "items": { "type": "string" } },
    "allow_network": { "type": "boolean" },
    "author": { "type": "string" },
    "configuration": { "type": "object" },
    "permissions": { "type": "array", "items": { "type": "string" } },
    "integrations": { "type": "object" },
    "requires_sandbox": { "type": "boolean" },
    "background_task": { "type": "boolean" },
    "isolate_on_failure": { "type": "boolean" },
    "keywords": { "type": "array", "items": { "type": "string" } },
    "system_requirements": {
      "type": "object",
      "properties": {
        "packages": { "type": "array", "items": { "type": "string" } },
        "permissions": { "type": "array", "items": { "type": "string" } }
      }
    }
  },
  "required": ["name"],
  "additionalProperties": true
}
